{
  "batchId": "01K6B3P1Z8Y7X6W5V4T3S2R1Q0",
  "reviewId": "01K6B3A1B2C3D4E5F6G7H8J9KM",
  "summary": "First pass over billing.",
  "submittedAt": "2026-09-29T07:20:00Z",
  "seq": 1832,
  "openedRequests": [
    {
      "id": "01K6B3P2A9QRSTVWXYZ0123456",
      "reviewId": "01K6B3A1B2C3D4E5F6G7H8J9KM",
      "repositoryId": "01K6B2Z0R3P0S1T2V3W4X5Y6Z7",
      "status": "open",
      "awaiting": "agent",
      "resolution": null,
      "closed": false,
      "anchor": {
        "kind": "symbol",
        "path": "src/Billing/InvoiceTotals.php",
        "range": {
          "startLine": 38,
          "endLine": 49
        },
        "symbol": {
          "language": "php",
          "kind": "method",
          "fqn": "App\\Billing\\InvoiceTotals::total()"
        }
      },
      "summary": "Use `Money` instead of `float` for totals.",
      "author": {
        "kind": "user",
        "userId": "01K6AZZ9Y8X7W6V5T4S3R2Q1P0",
        "agentName": null,
        "name": "janklan",
        "avatarUrl": "https://avatars.githubusercontent.com/u/1?v=4"
      },
      "claimedBy": null,
      "claimedAt": null,
      "commentCount": 0,
      "commitCount": 0,
      "pendingCommitCount": 0,
      "outdated": null,
      "createdAt": "2026-09-29T07:20:00Z",
      "updatedAt": "2026-09-29T07:20:00Z",
      "lastEventSeq": 1830
    }
  ],
  "replies": [
    {
      "requestId": "01K6B3P2A9QRSTVWXYZ0123457",
      "commentId": "01K6C3C0MMENT0000000000001"
    }
  ]
}
